{
  "schema_version": "0.1.0",
  "estimate_id": "estimate_01",
  "content_digest": "sha256:3333333333333333333333333333333333333333333333333333333333333333",
  "run_id": "run_foundation_01",
  "estimand_id": "estimand_conversion_itt",
  "contrast": {"baseline_intervention_id": "control", "comparison_intervention_id": "treatment"},
  "effect_measure": "risk_difference",
  "point_estimate": 0.023,
  "uncertainty": {"kind": "confidence_interval", "level": "0.95", "lower": 0.004, "upper": 0.042, "standard_error": 0.0097, "p_value": 0.018},
  "sample_size": {"total": 20000, "groups": {"control": 10000, "treatment": 10000}},
  "lineage": {
    "protocol_revision_id": "sha256:bbbbbbbbbbbbbbbbbbbbbbbbbbbbbbbbbbbbbbbbbbbbbbbbbbbbbbbbbbbbbbbb",
    "metric": {"metric_id": "metric_conversion", "metric_version": "v1", "metric_digest": "sha256:4444444444444444444444444444444444444444444444444444444444444444"},
    "query_ids": ["sha256:7777777777777777777777777777777777777777777777777777777777777777"],
    "source_snapshot_ids": ["source_fixture"],
    "runner": {"name": "legacy_stats_kernel", "version": "1.3.1", "build_digest": "sha256:ffffffffffffffffffffffffffffffffffffffffffffffffffffffffffffffff", "dependency_lock_digest": "sha256:aaaaaaaaaaaaaaaaaaaaaaaaaaaaaaaaaaaaaaaaaaaaaaaaaaaaaaaaaaaaaaaa", "analyzer_version": "newcombe_v1", "policy_version": "practical_v1"}
  },
  "produced_at": "2026-08-21T21:01:00Z",
  "extensions": {}
}
